[
  {
    "confidence": "high",
    "country_or_group": "AR",
    "definition": "def",
    "description": "desc",
    "id": "br0",
    "locator": null,
    "metric": "gdp",
    "period": "1990-2000",
    "retrieved_at": "2026-10-02",
    "snippet": null,
    "source": "MOCK",
    "source_id": "mock:M000",
    "source_url": null,
    "unit": "pct",
    "value": 2.0
  },
  {
    "confidence": "high",
    "country_or_group": "AR",
    "definition": "def",
    "description": "desc",
    "id": "br1",
    "locator": null,
    "metric": "gdp",
    "period": "1990-2000",
    "retrieved_at": "2026-10-02",
    "snippet": null,
    "source": "MOCK",
    "source_id": "mock:M001",
    "source_url": null,
    "unit": "pct",
    "value": 2.0
  },
  {
    "confidence": "high",
    "country_or_group": "AR",
    "definition": "def",
    "description": "desc",
    "id": "br2",
    "locator": null,
    "metric": "gdp",
    "period": "1990-2000",
    "retrieved_at": "2026-10-02",
    "snippet": null,
    "source": "MOCK",
    "source_id": "mock:M002",
    "source_url": null,
    "unit": "pct",
    "value": 2.0
  },
  {
    "confidence": "high",
    "country_or_group": "AR",
    "definition": "def",
    "description": "desc",
    "id": "br3",
    "locator": null,
    "metric": "gdp",
    "period": "1990-2000",
    "retrieved_at": "2026-10-02",
    "snippet": null,
    "source": "MOCK",
    "source_id": "mock:M003",
    "source_url": null,
    "unit": "pct",
    "value": 2.0
  },
  {
    "confidence": "high",
    "country_or_group": "AR",
    "definition": "def",
    "description": "desc",
    "id": "br4",
    "locator": null,
    "metric": "gdp",
    "period": "1990-2000",
    "retrieved_at": "2026-10-02",
    "snippet": null,
    "source": "MOCK",
    "source_id": "mock:M004",
    "source_url": null,
    "unit": "pct",
    "value": 2.0
  },
  {
    "confidence": "high",
    "country_or_group": "AR",
    "definition": "def",
    "description": "desc",
    "id": "br_null",
    "locator": null,
    "metric": "gdp",
    "note": "null value",
    "period": "1990-2000",
    "retrieved_at": "2026-10-02",
    "snippet": null,
    "source": "MOCK",
    "source_id": "mock:M_null",
    "source_url": null,
    "unit": "pct",
    "value": null
  }
]
